{
  "$schema": "https://json-schema.org/draft/2020-12/schema",
  "$id": "https://harness.example/schemas/v0.2/memory-index.schema.json",
  "title": "Memory Index Entry",
  "type": "object",
  "required": ["memory_id", "tier", "scope", "sensitivity", "freshness"],
  "properties": {
    "memory_id": { "type": "string" },
    "tier": { "type": "string", "enum": ["L0", "L1", "L2", "L3"] },
    "scope": { "type": "string", "enum": ["campaign", "cross_campaign", "organization"] },
    "domain": { "type": "string" },
    "subdomain": { "type": "string" },
    "sensitivity": { "type": "string", "enum": ["public", "internal", "pii", "secret"] },
    "freshness": { "type": "string", "format": "date" },
    "expires": { "type": ["string", "null"], "format": "date" },
    "confidence": { "type": "number", "minimum": 0, "maximum": 1 },
    "source": { "type": "string" },
    "contributing_agents": { "type": "array", "items": { "type": "string" } },
    "supersedes": { "type": ["string", "null"] },
    "tags": { "type": "array", "items": { "type": "string" } },
    "body_ref": { "type": "string" }
  }
}
